{
  "id": "disease:example",
  "name": "example name",
  "simple_name": "example",
  "description": "example description",
  "source": "example source",
  "page": 1,
  "aliases": [
    "example aliases"
  ],
  "contagion": {
    "method": "example method",
    "description": "example description"
  },
  "save": {
    "ability": "strength",
    "dc": 1,
    "frequency": "example frequency"
  },
  "effects": [
    "example effects"
  ],
  "incubation": "example incubation",
  "duration": "example duration",
  "_meta": {}
}
